{
  "cooldownSeconds": 0,
  "unique_id": "dv02-bob-escape-v1",
  "title": "Fix Bob's shit",
  "intro": "Help je toekomstige zelf. Verzamel bewijs, prioriteer veilig en maak een briefing.",
  "theme": "future-message",
  "rooms": [
    { "id": "toekomstbericht", "title": "Toekomstbericht", "instruction": "Lees het bericht rustig en herlees het wanneer je wilt.", "terminal": { "text": "Hé. Ik ben jij, acht jaar later. Begin met bewijs verzamelen; trek nog geen conclusie.", "textAlternative": "Hé. Ik ben jij, acht jaar later. Begin met bewijs verzamelen; trek nog geen conclusie.", "mistakes": true }, "assets": [], "clues": [], "tasks": [{ "id": "gelezen", "type": "checklist", "prompt": "Wat heb je gedaan?", "items": [{ "id": "herlezen", "text": "Ik heb het bericht gelezen en zo nodig herlezen." }], "expected": ["herlezen"] }], "hints": ["Je hoeft niets te gokken."] },
    { "id": "bewijs", "title": "Bewijs verzamelen", "instruction": "Markeer per observatie of je dit zeker weet, vermoedt of nog moet navragen.", "assets": [{ "id": "logboek", "type": "text", "text": "In het logboek staat: map Project staat dubbel.", "assetAlt": "Tekst uit het logboek: map Project staat dubbel.", "caption": "Logboekfragment" }, { "id": "bureau-foto", "type": "image", "src": "./example-assets/futureme-photo.svg", "assetAlt": "Een eenvoudige demo-afbeelding van een bureau met laptop, map en USB-stick.", "caption": "Demo-afbeelding: lokale SVG" }, { "id": "bob-video", "type": "video", "src": "./example-assets/bob-demo.mp4", "assetAlt": "Korte demo-video met een kleurvlak en tekst: BOB VIDEO DEMO.", "caption": "Demo-video: lokaal MP4-bestand" }, { "id": "bob-audio", "type": "audio", "src": "./example-assets/bob-demo.wav", "assetAlt": "Korte demo-audio zonder gesproken persoonsgegevens.", "caption": "Demo-audio: lokaal WAV-bestand" }], "clues": [{ "id": "dubbel", "text": "Er zijn twee mappen met de naam Project." }], "tasks": [{ "id": "feiten", "type": "checklist", "prompt": "Welke bronhandelingen heb je uitgevoerd?", "items": [{ "id": "alles-bekeken", "text": "Ik heb alle bronstukken bekeken." }, { "id": "onderscheid", "text": "Ik heb feiten en aannames onderscheiden." }], "expected": ["alles-bekeken", "onderscheid"] }], "hints": ["Een observatie is nog geen oorzaak."] },
    { "id": "oorzaak", "title": "Oorzaak onderzoeken", "instruction": "Onderzoek drie mogelijke verklaringen. Koppel per aanwijzing alle hypotheses die nog mogelijk zijn. Als de bron geen oorzaak aantoont, kies je ook 'geen bewijs voor oorzaak'. Een hypothese is geen feit en meerdere hypotheses mogen naast elkaar blijven bestaan.", "assets": [{ "id": "hypotheses", "type": "text", "text": "Hypotheses: dief, ratten, warhoofd. Geen bewijs voor oorzaak is ook een geldig antwoord.", "assetAlt": "De drie hypotheses zijn dief, ratten en warhoofd. Er kan geen bewijs voor een oorzaak zijn.", "caption": "Onderzoekskader" }, { "id": "oorzaak-uitleg", "type": "text", "text": "Voorbeeld: twee mappen kunnen passen bij een warhoofd, maar bewijzen dat niet. Zonder sporen blijven ook dief en ratten mogelijke hypotheses.", "assetAlt": "Twee mappen kunnen passen bij een warhoofd maar bewijzen dat niet. Zonder sporen blijven dief en ratten mogelijke hypotheses.", "caption": "Hoe je voorzichtig redeneert" }], "clues": [{ "id": "dubbel", "text": "Er zijn twee mappen met de naam Project." }, { "id": "onbekend", "text": "De bron zegt niet wie of wat dit veroorzaakte." }], "tasks": [{ "id": "hypotheses-koppelen", "type": "classify", "prompt": "Welke verklaringen blijven per aanwijzing mogelijk? Selecteer er meerdere als de bron niet genoeg onderscheid maakt.", "categories": ["dief", "ratten", "warhoofd", "geen-bewijs"], "allowMultiple": true, "expected": { "dubbel": ["dief", "ratten", "warhoofd"], "onbekend": ["geen-bewijs"] }, "feedbackCorrect": "Goed: je houdt hypotheses voorlopig open en noemt gebrek aan bewijs expliciet.", "feedbackIncorrect": "Kijk opnieuw naar het verschil tussen een aanwijzing en bewijs voor een oorzaak. Laat meerdere hypotheses staan als de bron niet onderscheidt." }, { "id": "open-vraag", "type": "text", "prompt": "Welke open vraag stel je voordat je iemand beschuldigt?", "expected": ["welke"], "minLength": 20, "feedbackIncorrect": "Formuleer een open vraag en gebruik geen ongefundeerde beschuldiging." }], "hints": ["Een dubbele map is een observatie, geen bewijs dat iemand een dief is.", "Als één aanwijzing bij meerdere verklaringen past, selecteer je ze allemaal.", "Gebruik 'geen-bewijs' wanneer de bron geen oorzaak ondersteunt."], "teacherChecklist": ["Student benoemt minimaal één feit zonder het als oorzaak te presenteren.", "Student laat meerdere hypotheses naast elkaar bestaan waar passend.", "Student kan 'geen bewijs voor oorzaak' gebruiken.", "Student formuleert een open vraag.", "Student doet geen ongefundeerde beschuldiging."] },
    { "id": "prioriteren", "title": "Prioriteren", "instruction": "Zet de veilige kernvolgorde met de knoppen omhoog en omlaag.", "assets": [], "clues": [], "tasks": [{ "id": "veilige-volgorde", "type": "order", "prompt": "Wat doe je eerst?", "items": [{ "id": "veiligstellen", "text": "Veiligstellen en documenteren" }, { "id": "navragen", "text": "Navragen en inventariseren" }, { "id": "overzicht", "text": "Een eenvoudig overzicht maken" }, { "id": "aanpassen", "text": "Pas later aanpassen of automatiseren" }], "expected": ["veiligstellen", "navragen", "overzicht", "aanpassen"] }], "hints": ["Bewaar eerst wat er is.", "Documenteer voordat je iets verandert.", "Veiligstellen/documenteren komt voor navragen/inventariseren."] },
    { "id": "briefing", "title": "Briefing afronden", "instruction": "Schrijf een korte briefing voor les 3. Downloaden is een aparte, expliciete actie.", "assets": [{ "id": "briefing-format", "type": "text", "text": "Gebruik: Feiten, Aannames, Open vragen, Veilige volgende stap.", "assetAlt": "De briefing bevat de koppen Feiten, Aannames, Open vragen en Veilige volgende stap.", "caption": "Briefingformat" }], "clues": [], "tasks": [{ "id": "briefing", "type": "text", "prompt": "Schrijf je briefing met feiten, aannames, minimaal één open vraag en een veilige volgende stap.", "expected": ["feiten", "aannames", "vraag"], "minLength": 80 }], "hints": ["Gebruik vaste koppen.", "Zet niet-bewezen oorzaken bij aannames.", "Eindig met veiligstellen/documenteren of navragen."] , "teacherChecklist": ["Feiten zijn herleidbaar tot bronstukken.", "Aannames worden als aannames benoemd.", "Er staat minimaal één open vraag.", "De prioriteit is veilig en uitvoerbaar.", "Er staat geen ongefundeerde beschuldiging.", "De briefing is bruikbaar voor les 3."] }
  ],
  "successMessage": "De fluxcondensator reageert. Je briefing kan naar les 3.",
  "allowHints": true,
  "persistProgress": true,
  "showProgress": true,
  "progressPosition": "bottom",
  "showReset": true
}
